{
  "$schema": "https://json-schema.org/draft/2020-12/schema",
  "$id": "https://github.com/marcelomamorim/witup-llm/schemas/pipeline.schema.json",
  "title": "witup-llm pipeline",
  "type": "object",
  "additionalProperties": false,
  "required": ["version", "project", "pipeline", "models"],
  "properties": {
    "version": {
      "type": "string",
      "const": "1"
    },
    "project": {
      "type": "object",
      "additionalProperties": false,
      "required": ["root"],
      "properties": {
        "root": {"type": "string", "minLength": 1},
        "include": {"type": "array", "items": {"type": "string"}},
        "exclude": {"type": "array", "items": {"type": "string"}},
        "overview_file": {"type": "string"},
        "test_framework": {"type": "string"}
      }
    },
    "pipeline": {
      "type": "object",
      "additionalProperties": false,
      "properties": {
        "output_dir": {"type": "string"},
        "replication_root": {"type": "string"},
        "baseline_file": {"type": "string"},
        "save_prompts": {"type": "boolean"},
        "max_methods": {"type": "integer", "minimum": 0},
        "judge_model": {"type": "string"},
        "llm_mode": {"type": "string", "enum": ["direct", "multiagent"]},
        "deep_validation_subset_size": {"type": "integer", "minimum": 0}
      }
    },
    "models": {
      "type": "object",
      "minProperties": 1,
      "additionalProperties": {
        "type": "object",
        "additionalProperties": false,
        "required": ["provider", "model", "base_url", "api_key_env"],
        "properties": {
          "provider": {"type": "string", "enum": ["openai_compatible", "ollama"]},
          "model": {"type": "string", "minLength": 1},
          "base_url": {"type": "string", "minLength": 1},
          "api_key_env": {"type": "string", "minLength": 1},
          "temperature": {"type": "number", "minimum": 0},
          "timeout_seconds": {"type": "integer", "exclusiveMinimum": 0},
          "max_retries": {"type": "integer", "minimum": 0},
          "reasoning_effort": {"type": "string", "enum": ["none", "low", "medium", "high", "xhigh"]},
          "prompt_cache_retention": {"type": "string"},
          "service_tier": {"type": "string", "enum": ["auto", "default", "flex", "priority"]},
          "max_output_tokens": {"type": "integer", "minimum": 0}
        }
      }
    },
    "metrics": {
      "type": "array",
      "items": {
        "type": "object",
        "additionalProperties": false,
        "required": ["name", "command"],
        "properties": {
          "name": {"type": "string", "minLength": 1},
          "kind": {"type": "string"},
          "command": {"type": "string", "minLength": 1},
          "weight": {"type": "number", "minimum": 0},
          "value_regex": {"type": "string"},
          "scale": {"type": "number", "minimum": 0},
          "working_directory": {"type": "string"},
          "timeout_seconds": {"type": "integer", "exclusiveMinimum": 0},
          "expected_outputs": {
            "type": "array",
            "items": {"type": "string"}
          },
          "description": {"type": "string"},
          "fallbacks": {
            "type": "array",
            "items": {
              "type": "object",
              "additionalProperties": false,
              "required": ["command"],
              "properties": {
                "name": {"type": "string"},
                "command": {"type": "string", "minLength": 1},
                "value_regex": {"type": "string"},
                "scale": {"type": "number", "minimum": 0},
                "working_directory": {"type": "string"},
                "timeout_seconds": {"type": "integer", "exclusiveMinimum": 0},
                "expected_outputs": {
                  "type": "array",
                  "items": {"type": "string"}
                },
                "description": {"type": "string"}
              }
            }
          }
        }
      }
    },
    "phase_two": {
      "type": "object",
      "additionalProperties": false,
      "properties": {
        "execution_mode": {"type": "string", "enum": ["strict_1call", "repair_1retry"]},
        "visualization_title": {"type": "string"},
        "projects": {
          "type": "array",
          "items": {
            "type": "object",
            "additionalProperties": false,
            "required": ["key", "root", "wit_analysis_path"],
            "properties": {
              "key": {"type": "string", "minLength": 1},
              "label": {"type": "string"},
              "root": {"type": "string", "minLength": 1},
              "wit_analysis_path": {"type": "string", "minLength": 1},
              "overview_file": {"type": "string"},
              "include": {"type": "array", "items": {"type": "string"}},
              "exclude": {"type": "array", "items": {"type": "string"}},
              "target_containers": {"type": "array", "items": {"type": "string"}},
              "test_framework": {"type": "string"}
            }
          }
        }
      }
    }
  }
}
